Task,Description,Priority,Status,Owner,Timeline,OWASP Mapping,Compliance,Notes
Incident Response Strategy Development,Develop comprehensive incident response strategy,High,Not Started,PIC,30 days,N/A,NIST CSF,Define incident response goals and procedures
Crisis Management Design,Design crisis management framework,High,Not Started,PIC,45 days,N/A,NIST CSF,Define crisis procedures and communication
Team Coordination Design,Design team coordination procedures,High,Not Started,PIC,45 days,N/A,NIST CSF,Define coordination procedures and communication
Communication Planning,Plan stakeholder communication,High,Not Started,PIC,30 days,N/A,NIST CSF,Define communication procedures and reporting
Post-Incident Analysis Planning,Plan post-incident analysis procedures,High,Not Started,PIC,45 days,N/A,NIST CSF,Define analysis procedures and lessons learned
Incident Response Implementation,Implement incident response procedures,High,Not Started,PIC,90 days,N/A,NIST CSF,Deploy and test incident response procedures
Crisis Management Implementation,Implement crisis management procedures,High,Not Started,PIC,90 days,N/A,NIST CSF,Deploy and test crisis management procedures
Team Coordination Implementation,Implement team coordination procedures,High,Not Started,PIC,90 days,N/A,NIST CSF,Deploy and test team coordination procedures
Communication Implementation,Implement stakeholder communication procedures,High,Not Started,PIC,75 days,N/A,NIST CSF,Deploy and test communication procedures
Incident Response Operations,Operate incident response procedures,Medium,Not Started,PIC,Ongoing,N/A,NIST CSF,Monitor incident response performance
Crisis Management Operations,Operate crisis management procedures,Medium,Not Started,PIC,Ongoing,N/A,NIST CSF,Monitor crisis management performance
Team Coordination Operations,Operate team coordination procedures,Medium,Not Started,PIC,Ongoing,N/A,NIST CSF,Monitor team coordination performance
Communication Operations,Operate stakeholder communication procedures,Medium,Not Started,PIC,Ongoing,N/A,NIST CSF,Monitor communication performance
Incident Response Analysis,Analyze incident response effectiveness,Medium,Not Started,PIC,Ongoing,N/A,NIST CSF,Analyze and optimize incident response procedures
Crisis Management Analysis,Analyze crisis management effectiveness,Medium,Not Started,PIC,Ongoing,N/A,NIST CSF,Analyze and optimize crisis management procedures
Team Coordination Analysis,Analyze team coordination effectiveness,Medium,Not Started,PIC,Ongoing,N/A,NIST CSF,Analyze and optimize team coordination procedures
Communication Analysis,Analyze communication effectiveness,Medium,Not Started,PIC,Ongoing,N/A,NIST CSF,Analyze and optimize communication procedures
Incident Response Optimization,Optimize incident response procedures,Medium,Not Started,PIC,90 days,N/A,NIST CSF,Improve incident response efficiency and effectiveness
Crisis Management Enhancement,Enhance crisis management capabilities,Medium,Not Started,PIC,90 days,N/A,NIST CSF,Improve crisis management capabilities
Incident Response Program Assessment,Assess incident response program effectiveness,Medium,Not Started,PIC,180 days,N/A,NIST CSF,Evaluate incident response program effectiveness

