Task ID,Task Name,Description,Priority,Status,Assigned To,Due Date,Completion Date,Notes,OWASP Mapping,Compliance,Category
SRE-001,System Reliability Engineering Implementation,Implement comprehensive system reliability engineering practices,High,Pending,SRE Team,2024-01-15,,Establish SLOs and error budgets,OWASP A01-A10,SOC2/ISO27001,Reliability Engineering
SRE-002,Monitoring and Alerting Setup,Implement comprehensive monitoring and alerting systems,High,Pending,SRE Team,2024-01-20,,Set up monitoring for all critical systems,OWASP A09,SOC2/ISO27001,Monitoring
SRE-003,Incident Response Procedures,Establish and maintain incident response procedures,High,Pending,SRE Team,2024-01-25,,Create incident response playbooks,OWASP A01-A10,SOC2/ISO27001,Incident Response
SRE-004,Disaster Recovery Planning,Implement disaster recovery and business continuity planning,High,Pending,SRE Team,2024-01-30,,Test and validate disaster recovery procedures,OWASP A02,SOC2/ISO27001,Disaster Recovery
SRE-005,Performance Optimization,Implement system performance optimization strategies,Medium,Pending,SRE Team,2024-02-05,,Optimize system performance and capacity,OWASP A05,SOC2/ISO27001,Performance
SRE-006,Capacity Planning,Implement capacity planning and resource management,Medium,Pending,SRE Team,2024-02-10,,Plan and manage system capacity,OWASP A05,SOC2/ISO27001,Capacity Management
SRE-007,Security Operations Integration,Integrate security operations with reliability engineering,High,Pending,SRE Team,2024-02-15,,Implement security monitoring and response,OWASP A01-A10,SOC2/ISO27001,Security Operations
SRE-008,Infrastructure Automation,Implement infrastructure automation and DevOps practices,High,Pending,SRE Team,2024-02-20,,Automate infrastructure provisioning and management,OWASP A05,SOC2/ISO27001,Automation
SRE-009,Service Level Objectives,Define and implement service level objectives (SLOs),High,Pending,SRE Team,2024-02-25,,Establish SLOs and error budgets,OWASP A01-A10,SOC2/ISO27001,Service Management
SRE-010,Chaos Engineering Implementation,Implement chaos engineering and resilience testing,Medium,Pending,SRE Team,2024-03-01,,Test system resilience through chaos engineering,OWASP A01-A10,SOC2/ISO27001,Testing
SRE-011,Reliability Metrics and KPIs,Establish reliability metrics and key performance indicators,Medium,Pending,SRE Team,2024-03-05,,Track and report reliability metrics,OWASP A01-A10,SOC2/ISO27001,Measurement
SRE-012,Post-Incident Reviews,Implement post-incident review and learning processes,High,Pending,SRE Team,2024-03-10,,Conduct thorough post-incident reviews,OWASP A01-A10,SOC2/ISO27001,Learning
SRE-013,Automated Testing,Implement automated testing for reliability,Medium,Pending,SRE Team,2024-03-15,,Automate reliability testing processes,OWASP A01-A10,SOC2/ISO27001,Testing
SRE-014,Documentation and Runbooks,Create comprehensive documentation and runbooks,Medium,Pending,SRE Team,2024-03-20,,Document all operational procedures,OWASP A01-A10,SOC2/ISO27001,Documentation
SRE-015,Team Training and Development,Provide training and development for SRE teams,Medium,Pending,SRE Team,2024-03-25,,Train teams on reliability practices,OWASP A01-A10,SOC2/ISO27001,Training
SRE-016,Compliance and Auditing,Ensure compliance with operational and security standards,High,Pending,SRE Team,2024-03-30,,Maintain compliance with standards,OWASP A01-A10,SOC2/ISO27001,Compliance
SRE-017,Cost Optimization,Implement cost optimization strategies,Medium,Pending,SRE Team,2024-04-05,,Optimize system costs and resource usage,OWASP A05,SOC2/ISO27001,Cost Management
SRE-018,Vendor Management,Manage third-party vendors and services,Medium,Pending,SRE Team,2024-04-10,,Manage vendor relationships and SLAs,OWASP A06,SOC2/ISO27001,Vendor Management
SRE-019,Communication and Reporting,Establish communication and reporting procedures,Medium,Pending,SRE Team,2024-04-15,,Communicate reliability status and issues,OWASP A01-A10,SOC2/ISO27001,Communication
SRE-020,Continuous Improvement,Implement continuous improvement processes,High,Pending,SRE Team,2024-04-20,,Continuously improve reliability processes,OWASP A01-A10,SOC2/ISO27001,Improvement
SRE-021,Technology Evaluation,Evaluate and implement new reliability technologies,Medium,Pending,SRE Team,2024-04-25,,Research and implement new technologies,OWASP A01-A10,SOC2/ISO27001,Technology
SRE-022,Process Standardization,Standardize reliability processes across teams,Medium,Pending,SRE Team,2024-04-30,,Standardize processes and procedures,OWASP A01-A10,SOC2/ISO27001,Standardization
SRE-023,Quality Assurance,Implement quality assurance for reliability processes,Medium,Pending,SRE Team,2024-05-05,,Ensure quality of reliability processes,OWASP A01-A10,SOC2/ISO27001,Quality Assurance
SRE-024,Innovation and Research,Conduct research and innovation in reliability engineering,Low,Pending,SRE Team,2024-05-10,,Research new reliability techniques,OWASP A01-A10,SOC2/ISO27001,Innovation
SRE-025,Stakeholder Management,Manage relationships with key stakeholders,Medium,Pending,SRE Team,2024-05-15,,Manage stakeholder relationships,OWASP A01-A10,SOC2/ISO27001,Stakeholder Management

