Category,Task,Description,Priority,Frequency,Owner,Status,Notes,OWASP Mapping,Compliance
Security Operations Supervision Strategy,Define security operations supervision strategy,Create comprehensive security operations supervision strategy and roadmap,High,Quarterly,PSS,Not Started,Define supervision goals, methodologies, and success metrics,A01-A10,GDPR/HIPAA/SOX/PCI DSS/SOC2
Team Coordination Design,Design team coordination framework,Create team coordination procedures and tools,High,Quarterly,PSS,Not Started,Design coordination procedures, tools, and reporting,A01-A10,GDPR/HIPAA/SOX/PCI DSS/SOC2
Incident Oversight Design,Design incident oversight framework,Create incident oversight procedures and tools,High,Quarterly,PSS,Not Started,Design oversight procedures, tools, and reporting,A01-A10,GDPR/HIPAA/SOX/PCI DSS/SOC2
Security Operations Management Design,Design security operations management framework,Create security operations management procedures and tools,High,Quarterly,PSS,Not Started,Design management procedures, tools, and reporting,A01-A10,GDPR/HIPAA/SOX/PCI DSS/SOC2
Security Reporting Design,Design security reporting framework,Create security reporting procedures and documentation,High,Quarterly,PSS,Not Started,Design reporting procedures, documentation, and communication,A01-A10,GDPR/HIPAA/SOX/PCI DSS/SOC2
Security Operations Supervision Implementation,Implement security operations supervision procedures,Deploy security operations supervision tools and procedures,High,Monthly,PSS,Not Started,Implement security tools, supervision procedures, and reporting systems,A01-A10,GDPR/HIPAA/SOX/PCI DSS/SOC2
Team Coordination Implementation,Implement team coordination procedures,Deploy team coordination tools and procedures,High,Monthly,PSS,Not Started,Implement coordination tools, security procedures, and reporting systems,A01-A10,GDPR/HIPAA/SOX/PCI DSS/SOC2
Incident Oversight Implementation,Implement incident oversight procedures,Deploy incident oversight tools and procedures,High,Monthly,PSS,Not Started,Implement oversight tools, security procedures, and reporting systems,A01-A10,GDPR/HIPAA/SOX/PCI DSS/SOC2
Security Operations Management Implementation,Implement security operations management procedures,Deploy security operations management tools and procedures,High,Monthly,PSS,Not Started,Implement management tools, security procedures, and reporting systems,A01-A10,GDPR/HIPAA/SOX/PCI DSS/SOC2
Security Operations Supervision Operations,Operate security operations supervision procedures,Execute security operations supervision operations and monitoring,High,Daily,PSS,Not Started,Operate security tools, supervision procedures, and reporting systems,A01-A10,GDPR/HIPAA/SOX/PCI DSS/SOC2
Team Coordination Operations,Operate team coordination procedures,Execute team coordination operations and monitoring,High,Daily,PSS,Not Started,Operate coordination tools, security procedures, and reporting systems,A01-A10,GDPR/HIPAA/SOX/PCI DSS/SOC2
Incident Oversight Operations,Operate incident oversight procedures,Execute incident oversight operations and monitoring,High,Daily,PSS,Not Started,Operate oversight tools, security procedures, and reporting systems,A01-A10,GDPR/HIPAA/SOX/PCI DSS/SOC2
Security Operations Management Operations,Operate security operations management procedures,Execute security operations management operations and monitoring,High,Daily,PSS,Not Started,Operate management tools, security procedures, and reporting systems,A01-A10,GDPR/HIPAA/SOX/PCI DSS/SOC2
Security Operations Supervision Analysis,Analyze security operations supervision effectiveness,Analyze security operations supervision performance and effectiveness,Medium,Weekly,PSS,Not Started,Analyze security data, performance metrics, and effectiveness,A01-A10,GDPR/HIPAA/SOX/PCI DSS/SOC2
Team Coordination Analysis,Analyze team coordination effectiveness,Analyze team coordination performance and effectiveness,Medium,Weekly,PSS,Not Started,Analyze coordination data, performance metrics, and effectiveness,A01-A10,GDPR/HIPAA/SOX/PCI DSS/SOC2
Incident Oversight Analysis,Analyze incident oversight effectiveness,Analyze incident oversight performance and effectiveness,Medium,Weekly,PSS,Not Started,Analyze oversight data, performance metrics, and effectiveness,A01-A10,GDPR/HIPAA/SOX/PCI DSS/SOC2
Security Operations Management Analysis,Analyze security operations management effectiveness,Analyze security operations management performance and effectiveness,Medium,Weekly,PSS,Not Started,Analyze management data, performance metrics, and effectiveness,A01-A10,GDPR/HIPAA/SOX/PCI DSS/SOC2
Security Operations Supervision Optimization,Optimize security operations supervision procedures,Optimize security operations supervision performance and efficiency,Medium,Monthly,PSS,Not Started,Optimize security procedures, performance improvement, and efficiency gains,A01-A10,GDPR/HIPAA/SOX/PCI DSS/SOC2
Team Coordination Enhancement,Enhance team coordination capabilities,Enhance team coordination capabilities and performance,Medium,Monthly,PSS,Not Started,Enhance coordination capabilities, performance improvement, and optimization,A01-A10,GDPR/HIPAA/SOX/PCI DSS/SOC2
Incident Oversight Enhancement,Enhance incident oversight capabilities,Enhance incident oversight capabilities and performance,Medium,Monthly,PSS,Not Started,Enhance oversight capabilities, performance improvement, and optimization,A01-A10,GDPR/HIPAA/SOX/PCI DSS/SOC2
Security Operations Supervision Program Assessment,Assess security operations supervision program effectiveness,Assess security operations supervision program effectiveness and performance,Medium,Quarterly,PSS,Not Started,Assess program effectiveness, capability evaluation, and improvement recommendations,A01-A10,GDPR/HIPAA/SOX/PCI DSS/SOC2
Security Tool Management,Manage security operations supervision tools,Manage and maintain security operations supervision tools and platforms,Medium,Weekly,PSS,Not Started,Manage security tools, coordination tools, and oversight tools,A01-A10,GDPR/HIPAA/SOX/PCI DSS/SOC2
Security Training,Provide security training,Provide security operations supervision and team coordination training,Medium,Monthly,PSS,Not Started,Provide training on security operations supervision, team coordination, and incident oversight,A01-A10,GDPR/HIPAA/SOX/PCI DSS/SOC2
Security Documentation,Maintain security documentation,Maintain security operations supervision and team coordination documentation,Medium,Weekly,PSS,Not Started,Maintain security documentation, coordination reports, and security procedures,A01-A10,GDPR/HIPAA/SOX/PCI DSS/SOC2
Security Metrics,Monitor security metrics,Monitor security operations supervision and team coordination metrics,Medium,Daily,PSS,Not Started,Monitor security metrics, supervision performance, and security effectiveness,A01-A10,GDPR/HIPAA/SOX/PCI DSS/SOC2
Security Incident Response,Respond to security incidents,Respond to security operations supervision and team coordination incidents,High,As Needed,PSS,Not Started,Respond to security incidents, supervision failures, and security breaches,A01-A10,GDPR/HIPAA/SOX/PCI DSS/SOC2
Security Compliance,Ensure security compliance,Ensure security operations supervision and team coordination compliance,High,Monthly,PSS,Not Started,Ensure compliance with security standards, regulations, and best practices,A01-A10,GDPR/HIPAA/SOX/PCI DSS/SOC2
Security Risk Assessment,Assess security risks,Assess security operations supervision and team coordination risks,Medium,Monthly,PSS,Not Started,Assess security risks, supervision risks, and security vulnerabilities,A01-A10,GDPR/HIPAA/SOX/PCI DSS/SOC2
Security Process Improvement,Improve security processes,Improve security operations supervision and team coordination processes,Medium,Quarterly,PSS,Not Started,Improve security processes, supervision procedures, and security workflows,A01-A10,GDPR/HIPAA/SOX/PCI DSS/SOC2
Security Stakeholder Communication,Communicate with stakeholders,Communicate security operations supervision and team coordination status to stakeholders,Medium,Weekly,PSS,Not Started,Communicate security status, supervision results, and security recommendations,A01-A10,GDPR/HIPAA/SOX/PCI DSS/SOC2
Security Budget Management,Manage security budget,Manage security operations supervision and team coordination budget,Medium,Monthly,PSS,Not Started,Manage security budget, supervision costs, and security investments,A01-A10,GDPR/HIPAA/SOX/PCI DSS/SOC2
Security Vendor Management,Manage security vendors,Manage security operations supervision and team coordination vendors,Medium,Monthly,PSS,Not Started,Manage security vendors, supervision providers, and security consultants,A01-A10,GDPR/HIPAA/SOX/PCI DSS/SOC2
Security Technology Evaluation,Evaluate security technologies,Evaluate security operations supervision and team coordination technologies,Medium,Quarterly,PSS,Not Started,Evaluate security technologies, supervision tools, and security platforms,A01-A10,GDPR/HIPAA/SOX/PCI DSS/SOC2
Security Standards Compliance,Ensure standards compliance,Ensure security operations supervision and team coordination standards compliance,High,Monthly,PSS,Not Started,Ensure compliance with security standards, frameworks, and regulations,A01-A10,GDPR/HIPAA/SOX/PCI DSS/SOC2
Security Audit Preparation,Prepare for security audits,Prepare for security operations supervision and team coordination audits,High,Quarterly,PSS,Not Started,Prepare audit documentation, evidence collection, and compliance verification,A01-A10,GDPR/HIPAA/SOX/PCI DSS/SOC2
Security Continuous Improvement,Implement continuous improvement,Implement security operations supervision and team coordination continuous improvement,Medium,Quarterly,PSS,Not Started,Implement process improvements, capability enhancements, and optimization,A01-A10,GDPR/HIPAA/SOX/PCI DSS/SOC2

