Task ID,Task Name,Description,Priority,Status,Assigned To,Due Date,Completion Date,Notes,OWASP Mapping,Compliance,Category
TM-001,Threat Modeling Program Implementation,Implement comprehensive threat modeling program,High,Pending,Threat Modeler Team,2024-01-15,,Establish threat modeling capabilities,OWASP A01-A10,NIST/ISO27001,Threat Modeling
TM-002,Threat Identification and Assessment,Implement threat identification and assessment processes,High,Pending,Threat Modeler Team,2024-01-20,,Develop threat identification methodologies,OWASP A01-A10,NIST/ISO27001,Threat Assessment
TM-003,Risk Assessment Framework,Establish risk assessment framework and processes,High,Pending,Threat Modeler Team,2024-01-25,,Implement risk assessment methodologies,OWASP A01-A10,NIST/ISO27001,Risk Assessment
TM-004,Security Architecture Review,Implement security architecture review and design,High,Pending,Threat Modeler Team,2024-01-30,,Conduct comprehensive architecture reviews,OWASP A01-A10,NIST/ISO27001,Architecture
TM-005,Attack Surface Analysis,Implement attack surface analysis and reduction,Medium,Pending,Threat Modeler Team,2024-02-05,,Analyze and minimize attack surfaces,OWASP A01-A10,NIST/ISO27001,Attack Surface
TM-006,Security Controls Design,Design and implement security controls and countermeasures,High,Pending,Threat Modeler Team,2024-02-10,,Implement effective security controls,OWASP A01-A10,NIST/ISO27001,Security Controls
TM-007,Threat Modeling Automation,Implement threat modeling automation and tooling,Medium,Pending,Threat Modeler Team,2024-02-15,,Automate threat modeling processes,OWASP A01-A10,NIST/ISO27001,Automation
TM-008,Threat Intelligence Integration,Integrate threat intelligence with threat modeling,Medium,Pending,Threat Modeler Team,2024-02-20,,Connect threat intelligence to modeling,OWASP A01-A10,NIST/ISO27001,Threat Intelligence
TM-009,Compliance and Standards,Ensure compliance with security and risk standards,High,Pending,Threat Modeler Team,2024-02-25,,Maintain compliance with standards,OWASP A01-A10,NIST/ISO27001,Compliance
TM-010,Threat Modeling Metrics,Establish threat modeling metrics and KPIs,Medium,Pending,Threat Modeler Team,2024-03-01,,Track threat modeling effectiveness,OWASP A01-A10,NIST/ISO27001,Measurement
TM-011,Threat Modeling Training,Provide comprehensive threat modeling training,Medium,Pending,Threat Modeler Team,2024-03-05,,Train teams on threat modeling techniques,OWASP A01-A10,NIST/ISO27001,Training
TM-012,Threat Modeling Documentation,Create comprehensive threat modeling documentation,Medium,Pending,Threat Modeler Team,2024-03-10,,Document threat modeling procedures,OWASP A01-A10,NIST/ISO27001,Documentation
TM-013,Threat Modeling Tools,Implement and configure threat modeling tools,High,Pending,Threat Modeler Team,2024-03-15,,Deploy threat modeling platforms,OWASP A01-A10,NIST/ISO27001,Tooling
TM-014,Threat Modeling Collaboration,Establish threat modeling collaboration and sharing,Medium,Pending,Threat Modeler Team,2024-03-20,,Collaborate with external partners,OWASP A01-A10,NIST/ISO27001,Collaboration
TM-015,Threat Modeling Quality Assurance,Implement quality assurance for threat modeling,Medium,Pending,Threat Modeler Team,2024-03-25,,Ensure quality of threat modeling activities,OWASP A01-A10,NIST/ISO27001,Quality Assurance
TM-016,Threat Modeling Innovation,Research and implement new threat modeling techniques,Low,Pending,Threat Modeler Team,2024-03-30,,Innovate threat modeling methodologies,OWASP A01-A10,NIST/ISO27001,Innovation
TM-017,Threat Modeling Risk Management,Implement risk management for threat modeling,Medium,Pending,Threat Modeler Team,2024-04-05,,Manage threat modeling risks,OWASP A01-A10,NIST/ISO27001,Risk Management
TM-018,Threat Modeling Communication,Establish threat modeling communication and reporting,Medium,Pending,Threat Modeler Team,2024-04-10,,Communicate threat modeling results,OWASP A01-A10,NIST/ISO27001,Communication
TM-019,Threat Modeling Continuous Improvement,Implement continuous improvement for threat modeling,High,Pending,Threat Modeler Team,2024-04-15,,Continuously improve threat modeling processes,OWASP A01-A10,NIST/ISO27001,Improvement
TM-020,Threat Modeling Stakeholder Management,Manage relationships with key stakeholders,Medium,Pending,Threat Modeler Team,2024-04-20,,Manage stakeholder relationships,OWASP A01-A10,NIST/ISO27001,Stakeholder Management
TM-021,Threat Modeling Technology Evaluation,Evaluate and implement new threat modeling technologies,Medium,Pending,Threat Modeler Team,2024-04-25,,Research new threat modeling technologies,OWASP A01-A10,NIST/ISO27001,Technology
TM-022,Threat Modeling Process Standardization,Standardize threat modeling processes across teams,Medium,Pending,Threat Modeler Team,2024-04-30,,Standardize threat modeling processes,OWASP A01-A10,NIST/ISO27001,Standardization
TM-023,Threat Modeling Performance Monitoring,Implement performance monitoring for threat modeling,Medium,Pending,Threat Modeler Team,2024-05-05,,Monitor threat modeling performance,OWASP A01-A10,NIST/ISO27001,Performance Monitoring
TM-024,Threat Modeling Vendor Management,Manage third-party threat modeling vendors and services,Medium,Pending,Threat Modeler Team,2024-05-10,,Manage vendor relationships,OWASP A01-A10,NIST/ISO27001,Vendor Management
TM-025,Threat Modeling Cost Optimization,Implement cost optimization for threat modeling,Medium,Pending,Threat Modeler Team,2024-05-15,,Optimize threat modeling costs,OWASP A01-A10,NIST/ISO27001,Cost Management

