Task ID,Task Name,Description,Priority,Status,Assigned To,Due Date,Completion Date,Notes,OWASP Mapping,Compliance,Category
TIE-001,Threat Intelligence Program Implementation,Implement comprehensive threat intelligence program,High,Pending,Threat Intel Engineer Team,2024-01-15,,Establish threat intelligence capabilities,OWASP A01-A10,NIST/ISO27001,Threat Intelligence
TIE-002,Intelligence Collection Setup,Implement threat intelligence collection systems,High,Pending,Threat Intel Engineer Team,2024-01-20,,Deploy intelligence collection tools,OWASP A01-A10,NIST/ISO27001,Intelligence Collection
TIE-003,Threat Actor Profiling,Establish threat actor profiling and attribution capabilities,High,Pending,Threat Intel Engineer Team,2024-01-25,,Develop actor profiling methodologies,OWASP A01-A10,NIST/ISO27001,Threat Attribution
TIE-004,Threat Landscape Assessment,Implement threat landscape assessment and reporting,High,Pending,Threat Intel Engineer Team,2024-01-30,,Conduct comprehensive threat assessments,OWASP A01-A10,NIST/ISO27001,Threat Assessment
TIE-005,Intelligence Analysis Capabilities,Establish threat intelligence analysis capabilities,Medium,Pending,Threat Intel Engineer Team,2024-02-05,,Develop analysis methodologies,OWASP A01-A10,NIST/ISO27001,Intelligence Analysis
TIE-006,Intelligence Sharing Framework,Implement intelligence sharing and collaboration framework,Medium,Pending,Threat Intel Engineer Team,2024-02-10,,Establish sharing protocols,OWASP A01-A10,NIST/ISO27001,Intelligence Sharing
TIE-007,Threat Intelligence Automation,Implement threat intelligence automation and orchestration,High,Pending,Threat Intel Engineer Team,2024-02-15,,Automate intelligence processes,OWASP A01-A10,NIST/ISO27001,Automation
TIE-008,Intelligence Quality Assurance,Establish intelligence quality assurance and validation,Medium,Pending,Threat Intel Engineer Team,2024-02-20,,Ensure intelligence quality,OWASP A01-A10,NIST/ISO27001,Quality Assurance
TIE-009,Threat Intelligence Metrics,Establish threat intelligence metrics and KPIs,Medium,Pending,Threat Intel Engineer Team,2024-02-25,,Track intelligence effectiveness,OWASP A01-A10,NIST/ISO27001,Measurement
TIE-010,Intelligence Training Program,Provide comprehensive threat intelligence training,Medium,Pending,Threat Intel Engineer Team,2024-03-01,,Train teams on intelligence operations,OWASP A01-A10,NIST/ISO27001,Training
TIE-011,Intelligence Documentation,Create comprehensive threat intelligence documentation,Medium,Pending,Threat Intel Engineer Team,2024-03-05,,Document intelligence procedures,OWASP A01-A10,NIST/ISO27001,Documentation
TIE-012,Intelligence Tools Implementation,Implement and configure threat intelligence tools,High,Pending,Threat Intel Engineer Team,2024-03-10,,Deploy intelligence platforms,OWASP A01-A10,NIST/ISO27001,Tooling
TIE-013,Intelligence Collaboration,Establish threat intelligence collaboration and partnerships,Medium,Pending,Threat Intel Engineer Team,2024-03-15,,Collaborate with external partners,OWASP A01-A10,NIST/ISO27001,Collaboration
TIE-014,Intelligence Compliance,Ensure compliance with intelligence and security standards,High,Pending,Threat Intel Engineer Team,2024-03-20,,Maintain compliance with standards,OWASP A01-A10,NIST/ISO27001,Compliance
TIE-015,Intelligence Innovation,Research and implement new threat intelligence techniques,Low,Pending,Threat Intel Engineer Team,2024-03-25,,Innovate intelligence methodologies,OWASP A01-A10,NIST/ISO27001,Innovation
TIE-016,Intelligence Risk Management,Implement risk management for threat intelligence,Medium,Pending,Threat Intel Engineer Team,2024-03-30,,Manage intelligence risks,OWASP A01-A10,NIST/ISO27001,Risk Management
TIE-017,Intelligence Communication,Establish intelligence communication and reporting,Medium,Pending,Threat Intel Engineer Team,2024-04-05,,Communicate intelligence findings,OWASP A01-A10,NIST/ISO27001,Communication
TIE-018,Intelligence Continuous Improvement,Implement continuous improvement for threat intelligence,High,Pending,Threat Intel Engineer Team,2024-04-10,,Continuously improve intelligence processes,OWASP A01-A10,NIST/ISO27001,Improvement
TIE-019,Intelligence Stakeholder Management,Manage relationships with key stakeholders,Medium,Pending,Threat Intel Engineer Team,2024-04-15,,Manage stakeholder relationships,OWASP A01-A10,NIST/ISO27001,Stakeholder Management
TIE-020,Intelligence Technology Evaluation,Evaluate and implement new threat intelligence technologies,Medium,Pending,Threat Intel Engineer Team,2024-04-20,,Research new intelligence technologies,OWASP A01-A10,NIST/ISO27001,Technology
TIE-021,Intelligence Process Standardization,Standardize threat intelligence processes across teams,Medium,Pending,Threat Intel Engineer Team,2024-04-25,,Standardize intelligence processes,OWASP A01-A10,NIST/ISO27001,Standardization
TIE-022,Intelligence Performance Monitoring,Implement performance monitoring for threat intelligence,Medium,Pending,Threat Intel Engineer Team,2024-04-30,,Monitor intelligence performance,OWASP A01-A10,NIST/ISO27001,Performance Monitoring
TIE-023,Intelligence Vendor Management,Manage third-party intelligence vendors and services,Medium,Pending,Threat Intel Engineer Team,2024-05-05,,Manage vendor relationships,OWASP A01-A10,NIST/ISO27001,Vendor Management
TIE-024,Intelligence Cost Optimization,Implement cost optimization for threat intelligence,Medium,Pending,Threat Intel Engineer Team,2024-05-10,,Optimize intelligence costs,OWASP A01-A10,NIST/ISO27001,Cost Management
TIE-025,Intelligence Security,Implement security measures for threat intelligence,High,Pending,Threat Intel Engineer Team,2024-05-15,,Secure intelligence operations,OWASP A01-A10,NIST/ISO27001,Security

